{
  "$schema": "http://json-schema.org/draft-04/schema#",
  "title": "campaign",
  "description": "A campaign description file for binder",
  "type": "object",
  "additionalProperties": false,
  "required": ["Typ","ID", "Name"],
  "properties": {
    "Typ": {
      "type": "string"
    },
    "ID": {
      "type": "string",
      "pattern": "^[a-z][a-z0-9]*$"
    },
    "Name": {
      "type": "string"
    },
    "Tags": {
      "type": "object",
      "patternProperties": {
        "^[A-ZÄÖÜ][A-ZÄÖÜa-zäöüß]*$": {
          "type": "array",
          "items": {
            "type": "string"
          }
        }
      }
    },
    "Nummer": {
      "type": ["integer", "null"]
    },
    "Titelbilder": {
      "type": "array",
      "items": {
        "type": "string",
        "pattern": "^[^\\\\\\/\\.]+\\.(jpg|png)$"
      }
    },
    "Text": {
      "type": "string"
    }
  }
}
