{
  "Typ": "campaign",
  "ID": "flaschengeist",
  "Name": "Der Geist in der Flasche",
  "Tags": {
    "Arcs": []
  },
  "Titelbilder": [],
  "Text": "Shanhazadrakhadifa, der Flaschengeist der Gruppe, wünscht sich, dass die Gruppe in ihrer Flasche ihre verschwundene Schwester wiederfindet. Dort tauchen die Helden in die finstere Vergangenheit ihrer Begleiterin ein und finden heraus, worum es sich beim Geist und ihrer Flasche tatsächlich handelt."
}
