{
  "Typ": "campaign",
  "ID": "sicmundus",
  "Name": "Sic Mundus",
  "Tags": {
    "Arcs": []
  },
  "Nummer": 3,
  "Titelbilder": [],
  "Text": "Auf einer Seereise gerät die Mannschaft der Brünstigen Maria in einen Sturm, der das Schiff in eine rückwärts durch die Zeit wandernde Globule befördert. Diese wurde in der Zukunft von Magiern als Utopia für freie Forschung geschaffen, geriet aber außer Kontrolle und wurde stattdessen als Gefängnis für Schwerverbrecher verwendet."
}
