{
  "Typ": "campaign",
  "ID": "abilacht",
  "Name": "Geister in Abilacht",
  "Tags": {
    "Arcs": []
  },
  "Nummer": 5,
  "Titelbilder": [],
  "Text": "In Abilacht wurde nächtliches Geistertreiben beobachtet. Tatsächlich handelt es sich um Mumien, die mit einem Grolm in Zusammenhang stehen, den die Bewohner in den Untergrund vertrieben haben."
}
