{
  "Typ": "campaign",
  "ID": "kessel",
  "Name": "Der Kessel",
  "Tags": {
    "Arcs": ["Insektenkrieg"]
  },
  "Nummer": 10,
  "Titelbilder": [],
  "Text": "Allerhand Schatzsucher und Glücksritter fallen in das Dorf Fiolbar ein, unter dem sich nicht nur ein Höhlensystem und ein verlassener Tempel befindet, sondern auch Hinterlassenschaften der frühen Insektenvölker."
}
